conceptType,conceptUri,preferredLabel,status,altLabels,description,broaderConceptUri,broaderConceptPT
Occupation,http://data.europa.eu/esco/occupation/35d41f4f-334b-452e-9e31-99f376302493,optoelectronic engineer,released,specialist in optoelectronics | optoelectronic engineering adviser | optoelectronic engineering consultant | optoelectronic engineer | engineer in optoelectronic systems | optoelectronic technology engineering expert | engineer in optoelectronics | optoelectronics specialist | optoelectronic technology engineering specialist | optoelectronic technology engineering adviser | opto-electronics engineer | optoelectronic technology engineering consultant | optoelectronic engineering expert | opto electronics engineer | opto-electronical engineer | senior optoelectronic engineer | optoelectronic systems engineer | optoelectronics engineer | optoelectronic engineering specialist | optoelectronic technology engineer | opto electronic engineer | optoelectronical engineer | opto electronical engineer | opto-electronic engineer | specialist in optoelectronic systems,"Optoelectronic engineers design and develop optoelectronic systems and devices, such as UV sensors, photodiodes, and LEDs. Optoelectronic engineering combines optical engineering with electronic engineering in the design of these systems and devices. They conduct research, perform analysis, test the devices, and supervise the research.",http://data.europa.eu/esco/occupation/4d34a9ee-2653-4da0-bef7-f59294577224,electronics engineer
Occupation,http://data.europa.eu/esco/occupation/3af4d6be-90b5-41f6-be06-3330dab3df73,social work researcher,released,social research interviewer | social science researcher | social work research manager | social work research assistant | social work research officer | social work researcher | social research worker | communities research worker | social scientist,"Social work researchers manage research projects aiming to investigate and provide reports on social issues. They first perform research by gathering information through interviews, focus groups and questionnaires; followed by organising and analysing the gathered information using computer software packages. They analyse social problems and needs, and the different ways and techniques to respond to them.",http://data.europa.eu/esco/occupation/11df8941-508c-4103-ad40-52cdf9430a59,sociologist
Occupation,http://data.europa.eu/esco/occupation/3c305542-a51b-4b96-8d45-af11ca05eaa2,veterinary medicine lecturer,released,veterinary science teacher | veterinary science lecturer | clinical lecturer in veterinary medicine | lector in veterinary medicine | veterinary medicine teacher | veterinary science instructor | veterinary science docent | veterinary medicine lector | university clinical lecturer in veterinary medicine | veterinary medicine docent | veterinary clinician | veterinary medicine lecturer | lecturer in veterinary medicine | lecturer of veterinary medicine | veterinary science professor | university veterinary medicine lecturer | veterinary medicine professor | instructor in veterinary medicine | teacher of veterinary medicine | veterinary medicine instructor | professor of veterinary medicine | university lecturer in veterinary medicine,"Veterinary medicine lecturers are subject professors, teachers, or lecturers, and often doctors who instruct students who have obtained an upper secondary education diploma in their own specialised field of study, veterinary medicine, which is predominantly academic in nature. They work with their university research assistants and university teaching assistants for the preparation of lectures and of exams, for grading papers and exams, for leading laboratory practices, and for leading review and feedback sessions for the students. They also conduct academic research in their respective field of veterinary medicine, publish their findings and liaise with other university colleagues.",http://data.europa.eu/esco/occupation/684fd8d5-9b40-4b02-a680-438f0082d923,higher education lecturer
Occupation,http://data.europa.eu/esco/occupation/3d7a1284-824c-47d9-8387-b8e1cd5888b5,dentistry lecturer,released,professor of dentistry | university clinical lecturer in dentistry | dental clinician | clinical lecturer in dentistry | dental science lecturer | university lecturer in dentistry | lecturer in dentistry | dental science lector | dentistry lecturer | dentistry professor | professor of dentistry studies | dentistry instructor | dentistry docent | dental sciences lector | dental sciences lecturer | university dentistry lecturer | dentistry lector | dentistry teacher,"Dentistry lecturers are subject professors, teachers, or lecturers, and often doctors who instruct students who have obtained an upper secondary education diploma in their own specialised field of study, dentistry, which is predominantly academic in nature. They work with their university research assistants and university teaching assistants for the preparation of lectures and of exams, for grading papers and exams, for leading laboratory practices, and for leading review and feedback sessions for the students. They also conduct academic research in their respective field of dentistry, publish their findings and liaise with other university colleagues.",http://data.europa.eu/esco/occupation/684fd8d5-9b40-4b02-a680-438f0082d923,higher education lecturer
Occupation,http://data.europa.eu/esco/occupation/3dbd758c-6dc0-41fe-8248-2250c9bfa4ab,climatologist,released,climate science researcher | climate research scientist | climatology analyst | climatologist | climatology researcher | climatology scientist | climate scholar | climatology scholar | climatologists | climate research analyst | climate scientist | climate researcher | climate analyst | climatology research analyst | climatology research scientist | climatology science researcher,"Climatologists study the average change in weather and climate from a long-term perspective. They research and analyse historic weather conditions in order to forecast climatic conditions trends such as changes in temperature, global warming, or regional evolutive weather conditions. They use these findings for advising on environmental policy, construction, agricultural projects, and societal matters.",http://data.europa.eu/esco/occupation/1c862e14-80f8-4aa8-8f1c-fd2ca95b63ad,meteorologist
Occupation,http://data.europa.eu/esco/occupation/3f7b7ce5-94b6-4e0c-98e7-a4ee5a6accf4,toxicologist,released,toxicology studies researcher | toxicology scientist | toxicology studies analyst | toxicology science researcher | toxicology analyst | toxicology studies scholar | toxicology studies research scientist | toxicology scholar | toxicologist | toxicology research scientist | toxicology studies research analyst | toxicology studies scientist | toxicology research analyst | toxicology researcher | toxicologists,"Toxicologists study the effects that chemical substances or biological and physical agents have in living organisms, more specifically, on the environment and on the animal and human health. They determine doses of the exposure to substances for arising toxic effects in environments, people, and living organisms, and also perform experiments on animals and cell cultures.",http://data.europa.eu/esco/occupation/eee68e13-8248-43bb-a9fb-959832a6c217,biologist
Occupation,http://data.europa.eu/esco/occupation/441a5b76-2f51-4704-9df7-3b8e715dd3ad,behavioural scientist,released,behavioural science researcher | behavioural science analyst | behavioural science scholar | behavioural science research analyst | behavioral scientist,"Behavioural scientists research, observe and describe human behaviour in society. They draw conclusions on the motives that stir actions in humans, observe the various circumstances for different behaviours, and describe different personalities. They advise organisations and governmental institutions on this field. They may also analyse the behaviour of animals.",http://data.europa.eu/esco/isco/C2632,"Sociologists, anthropologists and related professionals"
Occupation,http://data.europa.eu/esco/occupation/479ede81-bd51-4f3b-9d30-4910699fd211,journalism lecturer,released,professor of journalism | journalism and media docent | lecturer in journalism and media studies | journalism lector | journalism lecturer | media studies lecturer | journalism and media professor | journalism and media teacher | journalism and media instructor | university journalism lecturer | professor of media studies | journalism and media lecturer | specialist lecturer in journalism | higher education journalism teacher | media studies teacher | journalism teacher | university lecturer in journalism | lecturer in journalism | media studies instructor | lecturer in journalism and media | media studies docent | journalism docent | media studies professor | lecturer of journalism | journalism instructor | instructor in journalism | journalism professor,"Journalism lecturers and media are subject professors, teachers, or lecturers who instruct students who have obtained an upper secondary education diploma in their own specialised field of study, journalism and media, which is predominantly academic in nature. They work with their university research assistants and university teaching assistants for the preparation of lectures and of exams, for grading papers and exams and for leading review and feedback sessions for the students. They also conduct academic research in their respective field of journalism and media, publish their findings and liaise with other university colleagues.",http://data.europa.eu/esco/occupation/684fd8d5-9b40-4b02-a680-438f0082d923,higher education lecturer
Occupation,http://data.europa.eu/esco/occupation/49023c69-302f-4671-b26f-7229d1a53915,communications lecturer,released,lecturer in communication and media | communications instructor | lecturer in communications | communications teacher | university communications teacher | professor of communications | communication and media lecturer | communications docent | communications lecturer | communications lector | professor of communication | university lecturer in communications | university communications lecturer | communications professor | lecturer of communications | higher education communications teacher,"Communications lecturers are subject professors, teachers, or lecturers who instruct students who have obtained an upper secondary education diploma in their own specialised field of study, communications, which is predominantly academic in nature. They work with their university research assistants and university teaching assistants for the preparation of lectures and of exams, grading papers and exams and leading review and feedback sessions for the students. They also conduct academic research in their field of communications, publish their findings and liaise with other university colleagues.",http://data.europa.eu/esco/occupation/684fd8d5-9b40-4b02-a680-438f0082d923,higher education lecturer
Occupation,http://data.europa.eu/esco/occupation/4b759f0e-8fec-4cf5-80d4-d112a9fd4e51,oceanographer,released,oceanography scientist | marine physicist | oceanography researcher | oceanography science researcher | oceanography analyst | oceanography research scientist | marine geologist | marine chemist | marine research scientist | oceanographers | oceanography research analyst | oceanographer,"Oceanographers study and perform research on matters related to the sea and oceans. Oceanographers divide their expertise in different branches of research which are physical oceanographers whose research focus on waves and tides, chemical oceanographers whose study address the chemical constitution of sea waters, and geological oceanographer whose research refers to the bottom of seas and their plaques.",http://data.europa.eu/esco/occupation/c6196b21-20f9-4608-83fb-6f143afc740d,geologist
Occupation,http://data.europa.eu/esco/occupation/4e8a5d3e-66de-4661-9927-ef3123cc79e9,architecture lecturer,released,university lecturer in architectural studies | architecture professor | architecture docent | professor of architectural studies | lecturer of architecture | university architecture lecturer | lecturer in architectural studies | university lecturer in architecture | lecturer in architecture | instructor in architecture | architecture instructor | architecture lecturer | architecture lector | professor of architecture | university architectural studies lecturer | architecture teacher,"Architecture lecturers are subject professors, teachers, or lecturers who instruct students who have obtained an upper secondary education diploma in their own specialised field of study, architecture, which is predominantly academic in nature. They work with their university research assistants and university teaching assistants for the preparation of lectures and of exams, for grading papers and exams and for leading review and feedback sessions for the students. They also conduct academic research in their respective field of architecture, publish their findings and liaise with other university colleagues.",http://data.europa.eu/esco/occupation/684fd8d5-9b40-4b02-a680-438f0082d923,higher education lecturer
Occupation,http://data.europa.eu/esco/occupation/4f4d33a1-0b41-4dd9-8a42-aeba5a3974ab,sensor engineer,released,engineer specialised in sensor technology | engineer in sensor technology | sensor technology engineering consultant | sensor technology engineer | sensor engineering consultant | sensor development engineer | engineer of sensors | sensor technology engineering adviser | sensors engineer | actuator and sensor engineer | sensor engineering expert | electronic sensor engineer | engineer of sensors and actuators | sensor design engineer | sensor engineers | sensor engineer | sensor engineering adviser | sensor systems engineer | electronics sensor engineer | specialist sensor engineer | sensor technology engineering specialist | sensor developer | sensor designer | sensor technology engineering expert | sensor engineering specialist | sensor and actuator engineer,"Sensor engineers design and develop sensors, sensor systems and products that are equipped with sensors. They plan and monitor the manufacture of these products.",http://data.europa.eu/esco/occupation/4d34a9ee-2653-4da0-bef7-f59294577224,electronics engineer
Occupation,http://data.europa.eu/esco/occupation/4f89b0d2-b666-4890-af01-25d1d60da1f3,political scientist,released,peace researcher | political research scientist | political analyst | public administration researcher | political scientist | political science researcher | political studies researcher | pundit | war researcher | political researcher | political scholar | peace and conflict researcher | political studies research scientist | politics scienctist | political studies scholar | political studies scientist,"Political scientists study political behaviour, activity and systems, including the elements that fall therein. Their study of the field ranges from the origins and evolution of various political systems to topical matters such as decision-making processes, political behaviour, political trends, society, and power perspectives. They advise governments and institutional organisations on governance matters.",http://data.europa.eu/esco/isco/C2633,"Philosophers, historians and political scientists"
Occupation,http://data.europa.eu/esco/occupation/52ded7d7-11df-42e3-b90a-d7f4b70fb4b9,psychologist,released,expert counselling psychologist | counselling psychology practitioner | practitioner of counselling psychology | expert in counselling psychology | specialist counselling psychologist | occupational psychologist | sport and exercise psychologist | psychologist | psychology researcher | practitioner of sport and exercise psychology | practitioner of occupational psychology,"Psychologists study the behaviour and mental processes in humans. They provide services to clients who deal with mental health issues and life issues such as bereavement, relationship difficulties, domestic violence, and sexual abuse. They also provide counselling for mental health issues such as eating disorders, post-traumatic stress disorders, and psychosis in order to help the clients rehabilitate and reach a healthy behaviour.",http://data.europa.eu/esco/isco/C2634,Psychologists
Occupation,http://data.europa.eu/esco/occupation/55167849-82cf-484e-b818-fa702a4e69e9,hydrologist,released,hydrology researcher | hydrology science researcher | hydrology research analyst | hydrologists | hydrological engineer | hydrologist | hydrology scientist | water analysis specialist | hydrogeologist | hydrobiologist | surface hydrologist | hydrology analyst | hydrology research scientist,"Hydrologists research and study the quality, current challenges, and distribution of water in the Earth. They study water supply from rivers, streams, and springs to determine their adequate and sustainable use. Together with a cross functional team of professionals, they plan and develop how water can be supplied to cities and urban areas while ensuring efficiency and resource conservation.",http://data.europa.eu/esco/occupation/c6196b21-20f9-4608-83fb-6f143afc740d,geologist
Occupation,http://data.europa.eu/esco/occupation/557f9ccc-4e46-4bb2-8d20-272cd978b152,veterinary scientist,released,veterinary researcher,"Veterinary scientist develop and do research in animal models, compare basic biology across animals, and translate research findings to different species, including humans.",http://data.europa.eu/esco/isco/C2250,Veterinarians
Occupation,http://data.europa.eu/esco/occupation/55a785db-0636-41b8-950f-0b65abe5e81b,pharmacy lecturer,released,university pharmacology lecturer | lecturer of pharmacy | lecturer in pharmaceutics lecturer | lecturer in pharmaceutical sciences | lecturer in pharmacy | pharmacy docent | university pharmacy lecturer | pharmaceutics lecturer instructor | pharmaceutics lecturer professor | university lecturer in pharmacy | university pharmaceutical sciences teacher | pharmacy lecturer | professor of pharmacology | pharmacy teacher | university lecturer in pharmacology | university pharmaceutical sciences lecturer | pharmaceutics lecturer lector | higher education pharmaceutical sciences teacher | pharmacy instructor | pharmaceutics lecturer teacher | professor of pharmaceutical sciences | lecturer in pharmacology | pharmacy lector | pharmaceutics lecturer docent | university lecturer in pharmaceutical sciences | pharmacy professor | professor of pharmacy | pharmaceutics lecturer | higher education pharmacy teacher | university pharmacy teacher,"Pharmacy lecturers are subject professors, teachers, or lecturers who instruct students who have obtained an upper secondary education diploma in their own specialised field of study, pharmacy, which is predominantly academic in nature. They work with their university research assistants and university teaching assistants for the preparation of lectures and of exams, for leading laboratory practices, grading papers and exams and for leading review and feedback sessions for the students. They also conduct academic research in their field of pharmacy, publish their findings and liaise with other university colleagues.",http://data.europa.eu/esco/occupation/684fd8d5-9b40-4b02-a680-438f0082d923,higher education lecturer
Occupation,http://data.europa.eu/esco/occupation/574f3232-1d07-4034-8cac-c57ddbfff192,analytical chemist,released,analytical chemistry analyst | chemistry scholar | analytical chemistry research analyst | analytical chemistry scientist | chemistry scientist | chemistry science researcher | chemistry research analyst | chemist | chrystalographer | analytical chemistry research scientist | chemistry research scientist | analytical chemistry scholar | chemistry researcher | chemistry analyst | analytic chemist | analytical chemist | analytical chemistry science researcher | analytical chemistry researcher,"Analytical chemists research and describe the chemical composition of substances. Moreover, they draw conclusions related to the behaviour of such substances in different conditions. Analytical chemists play an important role in looking at the relationship between chemistry and the environment, food, fuel, and medicine. They use a range of techniques such as electro-chromatography, gas and high performance liquid chromatography and spectroscopy.",http://data.europa.eu/esco/occupation/0d93706d-32fd-4de3-aa08-be1003e325da,chemist
Occupation,http://data.europa.eu/esco/occupation/57a12047-4f1e-40ed-add5-9736923f231b,astronomer,released,astronomy scientist | astronomy analyst | astrophysicist | astronomy scholar | astronomer | astronomy science researcher | astronomy research analyst | astronomy research scientist | astronomers | astronomy researcher,"Astronomers research the formation, structures, properties, and development of celestial bodies and interstellar matter. They use ground-based equipment and space-based equipment to collect data about the space for research purposes.",http://data.europa.eu/esco/isco/C2111,Physicists and astronomers
Occupation,http://data.europa.eu/esco/occupation/59a02420-91df-4e46-b37b-22e3fd8c11f0,physics lecturer,released,university physics teacher | senior lecturer in physics | lecturer of physics | specialist lecturer in physics | lecturer in physics | university lecturer in physics | physics docent | higher education physics teacher | physics educator | physics instructor | university physics lecturer | professor of physics | physics lector | physics teacher | physics lecturer | physics professor,"Physics lecturers are subject professors, teachers, or lecturers who instruct students who have obtained an upper secondary education diploma in their own specialised field of study, physics, which is predominantly academic in nature. They work with their university research assistants and university teaching assistants 
for the preparation of lectures and of exams, for leading laboratory practices, grading papers and exams and for leading review and feedback sessions for the students. They also conduct academic research in their field of physics, publish their findings and liaise with&gt;other university colleagues.",http://data.europa.eu/esco/occupation/684fd8d5-9b40-4b02-a680-438f0082d923,higher education lecturer
Occupation,http://data.europa.eu/esco/occupation/5a282a39-5346-454a-b1ef-c1217c50e156,educational researcher,released,educational science researcher | educational research scientist | educational analyst | education studies research analyst | educational researcher | educational scientist | education researcher | education methods specialist | educational research analyst | education studies research scientist | pedagogue | education studies analyst | education studies scientist | education studies scholar | education studies researcher | educational scholar,"Educational researchers perform research in the area of education. They strive to broaden the knowledge on how education processes, educational systems, and individuals (teachers and learners) work. They foresee areas of improvement and develop plans for the implementation of innovations. They advise legislators and policy makers on educational issues and assist in the planning of educational policies.",http://data.europa.eu/esco/isco/C2351,Education methods specialists
Occupation,http://data.europa.eu/esco/occupation/5ac65daa-0896-4193-9f0e-8b00746b78a1,university research assistant,released,university research associate | research associate in university | assistant researcher in higher education | university assistant | university research technology expert | university research support worker | university research support | higher education research assistant | university research technology specialist | university research aide | university research assistant | university research technician | university research technologist | assistant researcher in university | research assistant in university | research associate in higher education | higher education research associate | higher education assistant researcher,"University research assistants conduct academic research for the university or college they are employed in. They may assist professors they are affiliated with, their supervisor, in their research or develop their own in the related field of that professor.",http://data.europa.eu/esco/occupation/684fd8d5-9b40-4b02-a680-438f0082d923,higher education lecturer
Occupation,http://data.europa.eu/esco/occupation/5fdfa822-c1ba-477e-87cc-3d742e59310d,biology lecturer,released,professor of biological sciences | lecturer in biology | biological sciences lector | biology lector | biology instructor | university biological sciences lecturer | university biology lecturer | university lecturer in biology | biological science lecturer | biological sciences lecturer | biology docent | professor of biology | university lecturer in biological science | lecturer in biological sciences | biology lecturer | instructor in biology | biology professor | biology teacher | higher education biology teacher | biological science lector,"Biology lecturers are subject professors, teachers, or lecturers who instruct students who have obtained an upper secondary education diploma in their own specialised field of study, biology. They work with their university research assistants and university teaching assistants in the preparation of lectures and of exams, leading laboratory practices, grading papers and exams and leading review and feedback sessions for the students. They also conduct academic research in their field of biology, publish their findings and liaise with other university colleagues.",http://data.europa.eu/esco/occupation/684fd8d5-9b40-4b02-a680-438f0082d923,higher education lecturer
