conceptType,conceptUri,preferredLabel,status,altLabels,description,broaderConceptUri,broaderConceptPT
Occupation,http://data.europa.eu/esco/occupation/01ffb917-98dc-48c1-91ad-93c4104e791d,biomedical engineer,released,biomedical engineer | BME consultant | bio-medical engineer | biomedical engineering adviser | biomedical technology engineering expert | BME adviser | biomedical engineering expert | BME expert | biomedical engineering consultant | biomedical technology engineering specialist | biomedical technology engineer | biomedical engineering specialist | biomedical technology engineering adviser | BME specialist | biomedical technology engineering consultant,"Biomedical engineers combine knowledge of engineering principles and biological findings for the development of medical treatments, medicaments, and general healthcare purposes. They can develop solutions ranging from the improvement of the components in conventional medicaments up to implants developments, and tissue treatment.",http://data.europa.eu/esco/occupation/f9433fdb-dde1-46cf-9e91-b49d243946a7,bioengineer
Occupation,http://data.europa.eu/esco/occupation/0611f232-b30e-46c7-9c26-2d59b1448e79,criminologist,released,criminology science researcher | criminology studies scholar | criminology studies scientist | criminologist | criminology research scientist | criminology scientist | criminology researcher | criminology scholar | criminology studies researcher | criminologists | criminology studies research scientist,Criminologists study conditions pertaining to humans such as the social and psychological aspects that could lead them to commit criminal acts. They observe and analyse different factors ranging from behavioural conditions up to social background and environment of suspects in order to advise organisations on the prevention of crime.,http://data.europa.eu/esco/isco/C2632,"Sociologists, anthropologists and related professionals"
Occupation,http://data.europa.eu/esco/occupation/0959cd1d-f6c8-4362-939a-ad7d5f75d659,economics lecturer,released,economics teacher | university economics lecturer | lecturer in economics | university lecturer in economics | professor of economics | senior lecturer in economics | economics lector | economics professor | higher education economics teacher | university economics teacher | lecturer of economics | economics instructor | economics lecturer | economics docent,"Economics lecturers are subject professors, assistant professors, teachers, lectures, assistant lecturers, mentors who instruct students in their own specialised field of study, economics. They develop curriculum, prepare classes (lectures, practical classes, seminars, trainings etc.), monitor learning outcomes, supervise student study path. They conduct academic research in their field of economics and present their findings at the conferences and in publications. They are involved in some university management functions.",http://data.europa.eu/esco/occupation/684fd8d5-9b40-4b02-a680-438f0082d923,higher education lecturer
Occupation,http://data.europa.eu/esco/occupation/0bf5d25a-2b4d-43b5-b053-beeb210fa43a,medicine lecturer,released,clinical lecturer | university lecturer in medicine | instructor of medicine | medicine instructor | lecturer of medicine | professor of medicine | medicine lector | university teacher of medicine | medicine professor | higher education teacher of medicine | medicine lecturer | clinical lecturer in medicine | medicine teacher | lecturer in medical education | lecturer in medicine | medicine docent | university medicine lecturer,"Medicine lecturers are subject professors, teachers, or lecturers, and often doctors who instruct students who have obtained an upper secondary education diploma in their own specialised field of study, medicine, which is predominantly academic in nature. They work with their university research assistants and university teaching assistants for the preparation of lectures and of exams, for grading papers and exams, for leading laboratory practices, and for leading review and feedback sessions for the students. They also conduct academic research in their respective field of medicine, publish their findings and liaise with other university colleagues.",http://data.europa.eu/esco/occupation/684fd8d5-9b40-4b02-a680-438f0082d923,higher education lecturer
Occupation,http://data.europa.eu/esco/occupation/0c7c9606-fde3-4658-8136-8fe0c9b8bd09,medical device engineer,released,engineer in biomedical systems | engineer of medical devices | biomedical systems developer | engineer of medical instruments | medical device developer | biomedical systems engineer | orthopaedic engineer | medical device engineer | audiology engineer | medical technology engineer | medical-technical equipment engineer | medical-technical test engineer | medical instrument engineer | clinical engineer | biomedical engineer | medical-technical device engineer | engineer of medical technology,"Medical device engineers design and develop medical-technical systems, installations, and equipment such as pacemakers, MRI scanners, and X-ray machines. They monitor the whole manufacturing process from concept design to product implementation. activities undertaken include, among others, designing product improvements, developing methods and techniques to evaluate design suitability, coordinating initial production, developing test procedures, and designing manufacturing diagrams.",http://data.europa.eu/esco/occupation/4d34a9ee-2653-4da0-bef7-f59294577224,electronics engineer
Occupation,http://data.europa.eu/esco/occupation/0cd729a6-ed11-4338-ac4b-d4b924390128,historian,released,diplomatic historian | historians | economic historian | egyptologist | military historian | political historian | art historian | historian,"Historians research, analyze, interpret, and present the past of human societies. They analyse documents, sources, and traces from the past in order to understand the past societies.",http://data.europa.eu/esco/isco/C2633,"Philosophers, historians and political scientists"
Occupation,http://data.europa.eu/esco/occupation/0d93706d-32fd-4de3-aa08-be1003e325da,chemist,released,toxicologist | chemical researcher | organic chemist | inorganic chemist | pharmacologist | chemist | chemical engineer | forensic chemist | research chemist | environmental chemist | manufacturing chemist | quality control chemist | industrial chemist | biochemist | production chemist | chemistry technician | quality assurance chemist | nuclear chemist | chemical analyst,Chemists perform laboratory research by testing and analysing the chemical structure of substances.They translate the research results into industrial production processes which are further used in the development or improvement of products. Chemists are also testing the quality of the manufactured products and their environmental impact.,http://data.europa.eu/esco/isco/C2113,Chemists
Occupation,http://data.europa.eu/esco/occupation/10291962-c0c7-4e5b-a7ed-0762b4d9b010,pharmacologist,released,pharmacology analyst | pharmacology scientist | pharmacology research analyst | pharmacologist | pharmacology science researcher | pharmacology studies analyst | pharmacology studies research analyst | pharmacology researcher | pharmacology studies scientist | pharmacology studies researcher | pharmacology research scientist | pharmacology scholar | pharmacology studies research scientist | pharmacology studies scholar | pharmacologists,"Pharmacologists study the manner in which drugs and medicaments interact with organisms, living systems, and their parts (i.e. cells, tissues, or organs). Their research aims at identifying substances that can be ingested by humans and that exert adequate biochemical functions for curing illnesses.",http://data.europa.eu/esco/isco/C2131,"Biologists, botanists, zoologists and related professionals"
Occupation,http://data.europa.eu/esco/occupation/116b4c55-5bd0-41e9-9227-98d7ecffeaf6,sociology lecturer,released,instructor in sociology | senior lecturer in sociology | social science lecturer | higher education sociology teacher | sociology lecturer | lecturer of sociology | specialist lecturer in sociology | lecturer in sociology | social science instructor | social science teacher | university sociology lecturer | lecturer of social science | sociology teacher | sociology docent | social science lector | lecturer in social science | professor of sociology | social science professor | social sciences lector | social science docent | sociology lector | sociology instructor | sociology professor,"Sociology lecturers are subject professors, teachers, or lecturers who instruct students who have obtained an upper secondary education diploma in their own specialised field of study, sociology, which is predominantly academic in nature. They work with their university research assistants and university teaching assistants 
for the preparation of lectures and of exams, grading papers and exams and leading review and feedback sessions for the students. They also conduct academic research in their field of sociology, publish their findings and liaise with other university colleagues.",http://data.europa.eu/esco/occupation/684fd8d5-9b40-4b02-a680-438f0082d923,higher education lecturer
Occupation,http://data.europa.eu/esco/occupation/11a6d0f6-e692-4774-aa5f-193b67d31022,kinesiologist,released,kinesiology science researcher | exercise scientist | psychomotor kinesiologist | exercise science researcher | exercise kinesiologist | kinesiologist | exercise research scientist | biomechanical kinesiologist | kinesiology scientist | exercise researcher | kinesiology researcher | kinesiologists | kinesiology research scientist,"Kinesiologists study and research the movement of the body; its muscles and parts. They analyse and use scientific data and methods to improve body motion, generally in humans, through an understanding of such areas as physiology, kinetics, neurology, and biology. They recognise the effects that some factors, such as body condition, have on motion and develop solutions to improve overall mechanics and mobility.",http://data.europa.eu/esco/isco/C2269,Health professionals not elsewhere classified
Occupation,http://data.europa.eu/esco/occupation/11b6390b-1e48-4903-a5df-d3e04b451a19,cosmetic chemist,released,formulation development chemist | cosmetics formulation chemist | research chemist | cosmetics formulator | cosmetics formulations chemist | cosmetic chemist | cosmetics formulation development chemist | cosmetics development formulator | skin care formulation chemist | cosmetics research chemist | cosmetics development chemist,"Cosmetic chemists develop formulas in order to create and test new cosmetic products and improve existing cosmetic products such as perfumes and fragrances, lipstick, waterproof lotions and makeup, hair dye, soaps and detergents with special properties, topical medicines or health supplements.",http://data.europa.eu/esco/occupation/0d93706d-32fd-4de3-aa08-be1003e325da,chemist
Occupation,http://data.europa.eu/esco/occupation/11d72bd6-779a-4643-9962-313833740094,environmental scientist,released,green infrastructure analyst | environmental researcher | land survey technician | geologist | geological technician | environmental impact expert | regulatory compliance environmental professional | environmental surveyor | environmental scientist advisor | environmental chemist | environmental scientist | geological technologist | environmental field scientist | environmental engineer | soil scientist | ecosystem restoration project manager | mineral technician | mineral technologist | field scientist," Environmental scientists identify problems and find solutions in order to minimize environmental hazards by performing analysis on samples such as air, water or soil. They advise on or develop environmental policies and aim to improve water supplies preservation and manage waste disposal sites. Environmental scientists perform environmental risk assessments and analyse the environmental impact of new solutions, construction sites or environmental changes ensuring the environmental regulations are followed.",http://data.europa.eu/esco/isco/C2133,Environmental protection professionals
Occupation,http://data.europa.eu/esco/occupation/11df8941-508c-4103-ad40-52cdf9430a59,sociologist,released,sociology research analyst | rural sociology analyst | rural sociology scholar | rural sociology research scientist | rural sociologist | economic sociology analyst | urban sociology scientist | gerontologist | rural sociology science researcher | economic sociology science researcher | economic sociology scholar | urban sociology analyst | sociology scientist | economic sociology scientist | intercultural communications adviser | sociologist | family and consumer science researcher | rural sociology scientist | urban sociology research analyst | sociology science researcher | sociology researcher | urban sociology research scientist | sociologists | urban sociologist | urban sociology science researcher | sociology research scientist | economic sociologist | sociology scholar | urban sociology researcher | urban sociology scholar | economic sociology research scientist | sociology analyst | rural sociology researcher | law sociologist | economic sociology research analyst | rural sociology research analyst | economic sociology researcher,"Sociologists focus their research on explaining social behaviour and the way people have organised themselves as a society. They research and explain the way societies have evolved by describing their legal, political, and economic systems and their cultural expressions.",http://data.europa.eu/esco/isco/C2632,"Sociologists, anthropologists and related professionals"
Occupation,http://data.europa.eu/esco/occupation/1738173e-ef9c-4222-88c8-b6aa9bad3cf7,biophysicist,released,biophysics biotechnologist | biophysics analyst | biophysicist | bio-physicist | biophysics research scientist | biophysics scientist | biophysics researcher | biophysics scholar | biophysics science researcher | biophysics research analyst,"Biophysicists study the existing relation between living organisms and physics. They conduct research on living organisms based on the methods of physics that aim to explain the complexity of life, predict patterns, and draw conclusions about aspects of life. Biophysicists' research fields cover DNA, proteins, molecules, cells, and environments.",http://data.europa.eu/esco/occupation/eee68e13-8248-43bb-a9fb-959832a6c217,biologist
Occupation,http://data.europa.eu/esco/occupation/19db5ad1-ffbf-41a0-8746-d3878f0d5dbd,media scientist,released,media research analyst | media studies scholar | media anthropologist | media research scientist | media analyst | media scholars | media studies researcher | media studies scientist | media science researcher | media researcher | media scientist | media studies research scientist,"Media scientists research the role and impact that media has on the society. They observe and document the usage of different kinds of media such as newspapers, radio and TV and the response from society.",http://data.europa.eu/esco/occupation/acf69cab-8629-45c8-ae10-c8fb15f474b6,anthropologist
Occupation,http://data.europa.eu/esco/occupation/1bbaf82c-67ae-4beb-9a55-7298acf5b2af,nursing lecturer,released,university nursing lecturer | nursing instructor | university nursing teacher | university nursing instructor | professor of nursing | senior lecturer in nursing | lecturer in nursing | university lecturer in nursing | nurse lecturer | nursing lector | nursing sciences lector | higher education nursing teacher | higher education nursing instructor | lector in nursing sciences | lector in nursing | nursing lecturer | lector in nursing science | nursing docent | nursing science lector | lecturer in nursing sciences | lecturer in nursing science | nursing professor | nursing teacher,"Nursing lecturers are subject professors, teachers, or lecturers, and often doctors who instruct students who have obtained an upper secondary education diploma in their own specialised field of study, nursing, which is predominantly academic in nature. They work with their university research assistants and university teaching assistants for the preparation of lectures and of exams, for grading papers and exams, for leading laboratory practices, and for leading review and feedback sessions for the students. They also conduct academic research in their respective field of nursing, publish their findings and liaise with other university colleagues.",http://data.europa.eu/esco/occupation/684fd8d5-9b40-4b02-a680-438f0082d923,higher education lecturer
Occupation,http://data.europa.eu/esco/occupation/1c862e14-80f8-4aa8-8f1c-fd2ca95b63ad,meteorologist,released,atmospheric research scientist | meteorologist | atmospheric science researcher | atmospheric researcher | atmospheric analyst | meteorology research analyst | atmospheric scientist | marine meteorologist | meteorology research scientist | meteorology analyst | meteorology researcher | atmospheric research analyst | meteorology science researcher | meteorology scientist,"Meteorologists study climate processes, measure and predict weather patterns and provide consultancy services to a variety of weather information users. They work out models for weather forecasting, develop instruments to collect meteorological data and compile statistics and databases.",http://data.europa.eu/esco/isco/C2112,Meteorologists
Occupation,http://data.europa.eu/esco/occupation/2026adb2-62d7-4b92-9ccb-105abdebe37d,electromagnetic engineer,released,electro magnetics engineer | electromagnetic technology engineering consultant | electromagnetic design engineer | electromagnetic engineering expert | engineer of electromagnetic systems | electromagnetics engineer | engineer in electromagnetic systems | electromagnetic technology engineering expert | electromagnetic engineering specialist | engineer specialist in electromagnetics | electromagnetic engineering adviser | EMC engineer | electromagnetic technology engineering specialist | engineer in electromagnetic compatibility | engineer in electromagnetic systems design | electromagnetic engineer | electromagnetic compatibility engineer | electromagnetic engineering consultant | electro-magnetics engineer | electro-magnetic engineer | electro magnetic engineer | electromagnetic technology engineer | electromagnetic technology engineering adviser | electromagnetic systems engineer,"Electromagnetic engineers design and develop electromagnetic systems, devices, and components, such as electromagnets in loudspeakers, electromagnetic locks, conducting magnets in MRI's, and magnets in electric motors.",http://data.europa.eu/esco/occupation/86ca306c-ab99-420a-9e2a-aa73c5c4de22,electrical engineer
Occupation,http://data.europa.eu/esco/occupation/203ea2ee-bbee-4aaf-83d7-2f2225f916e3,archaeologist,released,archaeology scholar | archaeology research scientist | epigraphist | archaeology analyst | archeologist | archaeology research analyst | archaeology researcher | marine archaeology science researcher | archaeologist scientist | marine archaeologist | excavation director | marine archaeology scholar | marine archaeology scientist | marine archaeology analyst | marine archaeology research analyst | marine archaeology researcher | archaeology science researcher | archaeology scientist | marine archaeology research scientist,"Archaeologists research and study past civilisations and settlements through collecting and inspecting material remains. They analyse and draw conclusions on a wide array of matters such as hierarchy systems, linguistics, culture, and politics based on the study of objects, structures, fossils, relics, and artifacts left behind by these peoples. Archaeologists utilise various interdisciplinary methods such as stratigraphy, typology, 3D analysis, mathematics, and modelling.",http://data.europa.eu/esco/isco/C2632,"Sociologists, anthropologists and related professionals"
Occupation,http://data.europa.eu/esco/occupation/25829508-63f3-41c3-affc-ddbb5c077930,physiologist,released,anatomist | anatomy researcher | physiology science researcher | physiology research scientist | physiology research analyst | anatomy research scientist | physiologist | physiology analyst | anatomy scientist | anatomy science researcher | physiology researcher | physiology scientist | physiologists | anatomy analyst | anatomy research analyst,"Physiologists study and exert research on the functioning of different living organisms, the parts they are composed of, and their interactions. They understand the fashion in which living systems react to factors such as diseases, physical activity, and stress, and use that information to develop methods and solutions to even out the effect that those stimuli have in living bodies.",http://data.europa.eu/esco/occupation/eee68e13-8248-43bb-a9fb-959832a6c217,biologist
Occupation,http://data.europa.eu/esco/occupation/258e46f9-0075-4a2e-adae-1ff0477e0f30,data scientist,released,data scientist | data research scientist | research data scientist | data expert | data engineer,"Data scientists find and interpret rich data sources, manage large amounts of data, merge data sources, ensure consistency of data-sets, and create visualisations to aid in understanding data. They build mathematical models using data, present and communicate data insights and findings to specialists and scientists in their team and if required, to a non-expert audience, and recommend ways to apply the data.",http://data.europa.eu/esco/isco/C2511,Systems analysts
Occupation,http://data.europa.eu/esco/occupation/30058b71-fe16-45ea-a2b8-d5461c706372,business lecturer,released,commerce professor | commerce docent | lecturer in commerce | professor of business administration | commerce instructor | university lecturer in business | university teacher of business | commerce lecturer | business professor | business docent | business instructor | business lector | business lecturer | lecturer of business | professor of business | commerce teacher | lecturer in business administration | business teacher | higher education teacher of business | senior lecturer in business | instructor of business | lecturer in business | commerce lector | university business lecturer,"Business lecturers are subject professors, teachers, or lecturers who instruct students who have obtained an upper secondary education diploma in their own specialised field of study, business, which is predominantly academic in nature. They work with their university research assistants and university teaching assistants 
for the preparation of lectures and of exams, grading papers and exams and leading review and feedback sessions for the students. They also conduct academic research in their field of business, publish their findings and liaise with other university colleagues.",http://data.europa.eu/esco/occupation/684fd8d5-9b40-4b02-a680-438f0082d923,higher education lecturer
Occupation,http://data.europa.eu/esco/occupation/306e9867-cf55-446f-88c6-8adad5369f8c,earth science lecturer,released,geoscience lector | geology lecturer | specialist lecturer in earth sciences | geology professor | geography lecturer | lecturer of earth sciences | earth science teacher | geoscience lecturer | university earth sciences lecturer | earth science instructor | instructor in earth sciences | earth science lecturer | geoscience professor | geoscience instructor | lecturer in earth science | lecturer of geoscience | lecturer in earth sciences | earth science professor | professor of earth science | geography professor | university lecturer in earth sciences | earth science lector | professor of geography | geoscience teacher | lecturer in geoscience | earth science docent | senior lecturer in earth sciences | earth sciences professor | geoscience docent | professor of geology | higher education earth sciences teacher,"Earth science lecturers are subject professors, teachers, or lecturers who instruct students who have obtained an upper secondary education diploma in their own specialised field of study, earth science, which is predominantly academic in nature. They work with their university research assistants and university teaching assistants in preparation of lectures and of exams, grading papers and exams and leading review and feedback sessions for the students. They also conduct academic research in their field of earth science, publish their findings and liaise with other university colleagues.",http://data.europa.eu/esco/occupation/684fd8d5-9b40-4b02-a680-438f0082d923,higher education lecturer
