conceptType,conceptUri,skillType,reuseLevel,preferredLabel,status,altLabels,description,broaderConceptUri,broaderConceptPT
KnowledgeSkillCompetence,http://data.europa.eu/esco/skill/dcc99418-d896-4b3b-8596-658093a17a8f,skill/competence,transversal,manage chronic health conditions,released,"utilise hearing, seeing or walking aids | seek for appropriate care ","Identify and use ways to minimise negative effects of chronic health conditions, including the use of seeing, hearing and walking aids, appropriate medications and adequate social and medical support.",http://data.europa.eu/esco/skill/3d54fec5-d9cb-45a0-bf8d-ffaf3790a5bb,applying health-related skills and competences
KnowledgeSkillCompetence,http://data.europa.eu/esco/skill/deb3c1bc-d48a-42e6-b0cc-cb238534ec28,skill/competence,transversal,apply knowledge of social sciences and humanities,released,demonstrate knowledge of European history | understand the role of social movements in society | demonstrate interest in politics  | demonstrate social knowledge,"Demonstrate an understanding of the nature, plurality and function of social and political groups, and their relation with the socioeconomic dimension of the society. Understand the role and place of individuals in society.",http://data.europa.eu/esco/skill/44ff6716-7d71-4a16-821b-61d10e9e290d,applying general knowledge
KnowledgeSkillCompetence,http://data.europa.eu/esco/skill/df5e3d02-9f0f-44ee-91c2-85c62f161868,skill/competence,transversal,"promote ideas, products, services ",released,convince others | enjoys selling | influence decisions | persuade others | persuade | influence others | be able to close sales regularly and confidently | present products,"Present and advertise products, programs and services with the goal of persuading and influencing others.",http://data.europa.eu/esco/skill/6f142deb-03a9-4cd7-94ce-e0f023ae2169,communicating
KnowledgeSkillCompetence,http://data.europa.eu/esco/skill/e2d44a9b-f28c-489e-9861-b654b5ded507,skill/competence,transversal,motivate others,released,inspire others | motivate others | stimulate action | energise others | empower others | encourage others | motivating others | motivate staff and colleages,Direct other people's behaviour by providing them with a convincing reason for action.,http://data.europa.eu/esco/skill/fe5eabaa-63f6-4c44-b405-fc3ded8d56cb,leading others
KnowledgeSkillCompetence,http://data.europa.eu/esco/skill/e37d64dc-0f05-4ee8-b065-bf76f70d8f5c,skill/competence,transversal,respect confidentiality obligations,released,protect privacy | keep secret information | ensure privacy | comply with confidentiality obligations | be discrete | ensure absolute discretion | handle sensitive information,"Observe the necessary discretion and restraint when dealing with confidential, secret or unpleasant information. ",http://data.europa.eu/esco/skill/925af2b5-2f4d-4cce-92cc-79e1ff887c7d,following ethical code of conduct
KnowledgeSkillCompetence,http://data.europa.eu/esco/skill/e49f4158-9d4c-425d-bf32-dfe89b19840a,skill/competence,transversal,plan ,released,implement planning | complete planning | perform planning | planning performance | plan activities | performance planning | undertake planning,Manage one's time schedule and resources in order to finish tasks in a timely manner.,http://data.europa.eu/esco/skill/66fdc34c-2326-4baa-b8ff-7a1d1015fe3a,planning and organising
KnowledgeSkillCompetence,http://data.europa.eu/esco/skill/ef7562b2-f176-4d7c-a0b2-27ae8cce0b7d,skill/competence,transversal,react to physical changes or hazards,released,be reactive | show responsivness | demonstrate agility,React and respond quickly  quickly and appropriately to external or internal circumstances and stimuli. ,http://data.europa.eu/esco/skill/e52389a2-1a05-45b0-8db3-4bda0f0c0b48,responding to physical circumstances
KnowledgeSkillCompetence,http://data.europa.eu/esco/skill/f4346299-e22a-4686-8e61-2c9b0cd51c7d,skill/competence,transversal,apply digital security measures,released,protect ICT devices | use anti-virus software | implement digital security measures | remove viruses and malware from a computer | up-date online security measures | protect digital devices | protect personal data,Follow simple ways to protect digital devices and content.,http://data.europa.eu/esco/skill/3399045f-8078-4066-8b46-475b49b260ab,working with digital devices and applications
KnowledgeSkillCompetence,http://data.europa.eu/esco/skill/f4bcdb75-df28-441d-a52b-9730904f36a1,skill/competence,transversal,exercise rights and responsibilities,released,participate in democratic decision-making | demonstrate interest in current events,"Be aware of and make use of constitutional and legal rights, including the duty to obey the law, pay taxes, and render assistance as well as the right to vote, to be elected, or to have a defence lawyer present in trial.",http://data.europa.eu/esco/skill/d6e97b91-b75d-45f5-8566-667798957b0f,applying civic skills and competences
KnowledgeSkillCompetence,http://data.europa.eu/esco/skill/fa46a48d-9cb9-422d-afab-1047654dbcdd,skill/competence,transversal,memorise information,released,memorising information | memorise procedures | memorise info | memorise facts | memorize information | remember information | learn information by heart | commit information to memory,"Store information such as words, numbers, pictures and procedures for later retrieval.",http://data.europa.eu/esco/skill/fff1d675-c36a-4c12-9cd4-407f21ccd06a,"processing information, ideas and concepts"
KnowledgeSkillCompetence,http://data.europa.eu/esco/skill/fd89f784-88dc-4d35-abd7-86aa073cab12,skill/competence,transversal,keep an open mind,released,take on new ideas and experiences | demonstrate freedom from prejudice | show acceptance of others | being open minded,Be interested and open to the problems of others. ,http://data.europa.eu/esco/skill/f5c9eef3-0495-4747-9519-d71a58d252bd,demonstrating willingness to learn
