conceptType,conceptUri,skillType,reuseLevel,preferredLabel,status,altLabels,description,broaderConceptUri,broaderConceptPT
KnowledgeSkillCompetence,http://data.europa.eu/esco/skill/001115fb-569f-4ee6-8381-c6807ef2527f,skill/competence,transversal,show initiative,released,take the initiative | give impetus | be a driving force | demonstrate sense of initiative | initiate action | show sense of initiative | show active initiative,"Be proactive and take the first step in an action without waiting for what others say or do.
",http://data.europa.eu/esco/skill/91860993-1a8b-4473-91f3-600aa1924bd0,taking a proactive approach
KnowledgeSkillCompetence,http://data.europa.eu/esco/skill/0171653e-c8e9-4c24-bb86-a4b6fe038f25,skill/competence,transversal,adopt ways to foster biodiversity and animal welfare,released,implement environmental choices in your own eating habit | adopt a sustainable eating habit | promoting organic and biological food consumption | take animal welfare into account when buying food products | concretely support biodiversity and animal welfare | take sustainability issues into account in consumption choices,"Engage in behaviours that help maintaining stable ecosystems and combatting mass extinction, for example by making conscious dietary choices that support organic food production and animal welfare. ",http://data.europa.eu/esco/skill/80cf002a-6586-4db7-9c9a-88325a9a5e1b,applying environmental skills and competences
KnowledgeSkillCompetence,http://data.europa.eu/esco/skill/045f71e6-0699-4169-8a54-9c6b96f3174d,skill/competence,transversal,advise others,released,make recommendations to others | provide advisory services | give advice to others | advise colleagues | give constructive feedback | mentor others | counsel others | advise customers | mentor individuals | counselling | giving advice to others | guide | offer suggestions to others | give advice,Offer suggestions about the best course of action.,http://data.europa.eu/esco/skill/82463bb1-85d1-4e99-a4ce-08508fc3b2a3,supporting others
KnowledgeSkillCompetence,http://data.europa.eu/esco/skill/05aa7c09-46e7-433f-a81b-92841f4551e7,skill/competence,cross-sector,accept criticism and guidance,released,welcome feedback | accept constructive criticism | accept critics | accept feedback | tolerate critics | handle feedback | welcome criticism,"Handle negative feedback from others and react openly to criticism, trying to identify in it potential areas for improvement. ",http://data.europa.eu/esco/skill/f5c9eef3-0495-4747-9519-d71a58d252bd,demonstrating willingness to learn
KnowledgeSkillCompetence,http://data.europa.eu/esco/skill/0b709c64-a57a-4976-86bd-34d2cf34fa4f,skill/competence,transversal,"apply knowledge of philosophy, ethics and religion",released,"apply philosophical school of thoughts   | evaluate the moral and ethical consequences of actions  | follow ethical values and religious believes | act according to ethical and religious values | assess the consequences and impact of ideas,  opportunities and  actions","Discover and develop an individual perspective about one's roles, meaning and purpose, including what it means to live, to die and to be human. ",http://data.europa.eu/esco/skill/44ff6716-7d71-4a16-821b-61d10e9e290d,applying general knowledge
KnowledgeSkillCompetence,http://data.europa.eu/esco/skill/0d75a128-bd88-4c1b-b70d-8e963aeb490c,skill/competence,transversal,adopt ways to reduce pollution,released,prefer public to private transport | use public transportation | prevent pollution  | reduce noise | handle your own waste,"Apply measures to reduce air, noise, light, water or environmental pollution, for example by using public transports, not leaving any waste in the natural environment, and reducing unnecessary light and noise emissions, particularly during the night.  ",http://data.europa.eu/esco/skill/80cf002a-6586-4db7-9c9a-88325a9a5e1b,applying environmental skills and competences
KnowledgeSkillCompetence,http://data.europa.eu/esco/skill/113b4428-0a31-4199-8496-070af7854b91,skill/competence,transversal,meet commitments,released,meet commitment | show conscientiousness | keep promises | meet targets | show reliability | demonstrate commitment | show responsibility | show commitment | achieve goals | meet commitments | demonstrate steady effort | demonstrate conscientiousness | meeting commitments | demonstrate punctuality | demonstrate reliability | work to deadlines | demonstrate loyalty,"Perform one's tasks in a self-disciplined, reliable and goal-oriented manner.",http://data.europa.eu/esco/skill/14c41899-0224-4cbc-bd8c-e946ada2da87,working efficiently
KnowledgeSkillCompetence,http://data.europa.eu/esco/skill/13b4a3d2-abdf-4442-8e52-d7464a58ecbc,skill/competence,transversal,adjust to physical demands,released,tolerate unfavourable temperatures | demonstrate physical resilience | work under adverse weather conditions,"Demonstrate the capacity to endure high physical stress from work or sport. It includes kneeling, standing or running for a long time or working under difficult meteorological conditions such as strong heat, cold and rain. ",http://data.europa.eu/esco/skill/e52389a2-1a05-45b0-8db3-4bda0f0c0b48,responding to physical circumstances
KnowledgeSkillCompetence,http://data.europa.eu/esco/skill/199f7919-5114-41b6-b6a5-41e0e4896ec1,skill/competence,transversal,assume responsibility,released,demonstrate responsibility | demonstrate a conscientious attitude | show responsible behaviour | show responsibility | be ready to take on responsibility | be responsible | showing responsibility | act responsibly | prove sense of responsibility | be ready to take responsibilities,"Accept responsibility and accountability for one's own professional decisions and actions, or those delegated to others.",http://data.europa.eu/esco/skill/91860993-1a8b-4473-91f3-600aa1924bd0,taking a proactive approach
KnowledgeSkillCompetence,http://data.europa.eu/esco/skill/19a64e91-bfe3-4c48-9225-3bb1229b12f0,skill/competence,transversal,show determination,released,strive for success | make an effort | demonstrate positive disposition | demonstrate positive attitude | persist | demonstrate a focussed approach | have clear goals | strive for results | demonstrate positive thinking | exhibit enthusiasm | demonstrate enthusiasm | show positive disposition,"Show commitment to do something that is difficult and requires hard work. Display great effort driven by an interest or enjoyment in work itself, in the absence of external pressures.",http://data.europa.eu/esco/skill/91860993-1a8b-4473-91f3-600aa1924bd0,taking a proactive approach
KnowledgeSkillCompetence,http://data.europa.eu/esco/skill/19ba11f3-9c99-41fd-a7c9-f77e6a026186,skill/competence,transversal,carry out calculations,released,carry out work-related calculations | use numbers | carry out work-related calculation,Solve mathematical problems to achieve work-related goals.,http://data.europa.eu/esco/skill/edc72cfe-78a8-4531-b00f-92992a0bb8cb,working with numbers and measures
KnowledgeSkillCompetence,http://data.europa.eu/esco/skill/1d1fedcb-4995-44ac-90f5-f31a157ce512,skill/competence,transversal,manage frustration,released,foster hope | manage emotions | handle frustration | recognise own potential | managing frustration | deal with frustration | manage frustration | show capacity to deal with stress | cope with frustration | manage own emotions | control impulses | manage disappointments  | cope well with setbacks | recover from setbacks | regulate moods,Stay calm and react in a constructive way to own or others' anger or when faced with obstacles or complaints.,http://data.europa.eu/esco/skill/2b2c3254-7f6c-47e2-84f1-aece946fbfae,maintaining a positive attitude
KnowledgeSkillCompetence,http://data.europa.eu/esco/skill/1dabb413-18e8-48ed-a963-44978e67ad32,skill/competence,transversal,calculate probabilities,released,estimate the probability of an outcome or fact | make estimations | work with probabilities,Predict the probability of an outcome based on calculations or experience.,http://data.europa.eu/esco/skill/edc72cfe-78a8-4531-b00f-92992a0bb8cb,working with numbers and measures
KnowledgeSkillCompetence,http://data.europa.eu/esco/skill/1ddc021d-d818-4731-904f-842d7491f419,skill/competence,transversal,manage financial and material resources,released,"select appropriate insurance products | use financial advices and guidance services with a critical mindset | manage personal finances | manage personal budget for financial needs | undertake effective financial planning | compare deals and offers when acquiring products or services | use credit, savings, investments and pensions to achieve long term goals | exercise consumer rights ","Undertake effective financial planning, using credit, savings, investments and pensions to achieve short and long term goals, using financial advices and guidance services with a critical mindset, comparing deals and offers when acquiring products or services and actively selecting appropriate insurance products.",http://data.europa.eu/esco/skill/6c6957bf-cf1f-4483-9c7e-1655f251b01a,applying entrepreneurial and financial skills and competences
KnowledgeSkillCompetence,http://data.europa.eu/esco/skill/1fce1197-3a5b-45b7-8797-575cd3b57a01,skill/competence,transversal,show commitment,released,show willingness to work | enjoy one's profession | demonstrate enthusiasm | demonstrate motivation | show motivation | demonstrate commitment | have commitment | show willingness to perform | enjoy working,"Show willingness to take on tasks immediately, even if they are difficult or uncomfortable. ",http://data.europa.eu/esco/skill/91860993-1a8b-4473-91f3-600aa1924bd0,taking a proactive approach
KnowledgeSkillCompetence,http://data.europa.eu/esco/skill/20012caa-b63c-4cb9-b2b8-01a1cfdfc1d1,skill/competence,transversal,think quickly,released,understand quickly | show a good level of perception | react quickly,Be able to grasp and process the most important aspects of facts and their connections quickly and accurately.,http://data.europa.eu/esco/skill/fff1d675-c36a-4c12-9cd4-407f21ccd06a,"processing information, ideas and concepts"
KnowledgeSkillCompetence,http://data.europa.eu/esco/skill/2aaad52d-599e-4e77-a681-bbc236825821,skill/competence,transversal,evaluate environmental impact of personal behaviour,released,apply ethical and sustainable thinking | adopt an environmental friendly attitude | adopt an ecological attitude | demonstrate sensitivity for environmental issues | consider the impact of your actions on the environment,Adopt a sustainability-oriented mindset in you daily life and reflect on your personal ecological attitude and on the environmental impact of your behaviour.,http://data.europa.eu/esco/skill/80cf002a-6586-4db7-9c9a-88325a9a5e1b,applying environmental skills and competences
KnowledgeSkillCompetence,http://data.europa.eu/esco/skill/35ebe444-9ece-4fbc-a55d-e99ea37267ae,skill/competence,transversal,manage quality,released,oversee quality | apply quality standards | monitor quality | manage quality | managing quality | attend to quality | work to agreed standards,"Pursue excellence in workplace processes, products and activities.",http://data.europa.eu/esco/skill/14c41899-0224-4cbc-bd8c-e946ada2da87,working efficiently
KnowledgeSkillCompetence,http://data.europa.eu/esco/skill/409a0245-0e6c-4aac-ba16-0920ecb76a8d,skill/competence,transversal,exercise self-reflection,released,reflect on practice | self-evaluate | perform self assessment | be able to engage in self-reflection | perform self-assessment | conduct self-assessment | self-assess | perform self-evaluation | do self-assessment,"Effectively, regularly and systematically reflect on own actions, performance, and attitudes, and make necessary adjustments, seeking professional development opportunities to plug knowledge and practice gaps in identified areas.",http://data.europa.eu/esco/skill/f5c9eef3-0495-4747-9519-d71a58d252bd,demonstrating willingness to learn
KnowledgeSkillCompetence,http://data.europa.eu/esco/skill/429062f1-a958-43ea-83dd-4e1af078c156,skill/competence,transversal,demonstrate curiosity,released,display curiosity | demonstrating curiosity | show curiosity | demonstrate interest | show interest | demonstrate curiosity | be curious | curiosity | exhibit curiosity,"Show a lively interest in novelty, an openness to experience, find subjects and topics fascinating, actively explore and discover new areas.",http://data.europa.eu/esco/skill/f5c9eef3-0495-4747-9519-d71a58d252bd,demonstrating willingness to learn
KnowledgeSkillCompetence,http://data.europa.eu/esco/skill/468135b7-5757-48c3-9509-fde0e13ec5be,skill/competence,transversal,manage personal progression,released,manage career goals | plan your career | manage life goals | market yourself,Take charge of and market your own skills and competences to advance in work and private life.,http://data.europa.eu/esco/skill/91860993-1a8b-4473-91f3-600aa1924bd0,taking a proactive approach
KnowledgeSkillCompetence,http://data.europa.eu/esco/skill/469748ce-051a-407e-9099-0c9415ac2705,skill/competence,transversal,approach challenges positively,released,show sense of humour | keep a positive attitude | adopt a constructive approach | maintain a positive attitude,Adopt a positive attitude and a constructive approach when dealing with challenges.,http://data.europa.eu/esco/skill/2b2c3254-7f6c-47e2-84f1-aece946fbfae,maintaining a positive attitude
KnowledgeSkillCompetence,http://data.europa.eu/esco/skill/4707da90-9cfc-46ca-8de0-38a0b7bfb137,skill/competence,transversal,think analytically,released,think in an analytical way | develop an analytical approach | analytical thinking | use logical reasoning | apply structural analysis | apply structured thinking | think analytically | think logically | apply logical thinking,"Produce thoughts using logic and reasoning in order to identify the strengths and weaknesses of alternative solutions, conclusions or approaches to problems.",http://data.europa.eu/esco/skill/fff1d675-c36a-4c12-9cd4-407f21ccd06a,"processing information, ideas and concepts"
KnowledgeSkillCompetence,http://data.europa.eu/esco/skill/49de9958-2aa4-4eef-a89d-fe5d5bcd28c4,skill/competence,transversal,adapt to change,released,be flexible | demonstrate flexibility | openness to change | adapt to change | revise plans to deal with changes | assimilate to change | be open to change | adapt to changes | adjust to change | show willingness to change | conform to change | adapting to change,Alter one's attitude or behaviour to accommodate modifications in the workplace.,http://data.europa.eu/esco/skill/f5c9eef3-0495-4747-9519-d71a58d252bd,demonstrating willingness to learn
KnowledgeSkillCompetence,http://data.europa.eu/esco/skill/4c3ab565-747c-4db3-8c47-79e8d6f98cf4,skill/competence,transversal,adopt ways to reduce negative impact of consumption,released,follow recycling collection schedules | reduce energy usage | follow environmentally-sustainable work practices | avoid single-use items | share physical resources | reduce water or energy consumption | practice a minimalist lifestyle | minimise waste production in households | avoid plastic | reuse products,"Apply principles, policies and regulations aimed at environmental sustainability, including the reduction of waste, energy and water consumption, the reuse and recycling of products, and the engagement in the sharing economy.",http://data.europa.eu/esco/skill/80cf002a-6586-4db7-9c9a-88325a9a5e1b,applying environmental skills and competences
KnowledgeSkillCompetence,http://data.europa.eu/esco/skill/4c772721-9280-49cb-9988-b6ea3d36b06d,skill/competence,transversal,maintain psychological well-being,released,balance working time and personal life | maintain work-life balance | safely use digital technologies | protect the psychological wellbeing | pursue mental wellbeing,"Be able to avoid threats to psychological well-being, for example while using digital technologies, including the maintenance of a healthy work-life-learn balance. ",http://data.europa.eu/esco/skill/3d54fec5-d9cb-45a0-bf8d-ffaf3790a5bb,applying health-related skills and competences
KnowledgeSkillCompetence,http://data.europa.eu/esco/skill/4cde32b5-fc2f-4257-a8b9-5b15a67ee3e5,skill/competence,transversal,protect the health of others,released,provide first aid | intervene promptly in case of need | safeguard one's person health | react adequately in case of accidents ,"Prevent harm from and support recovery of family members, wards, and fellow citizens, including adequate responses in case of accidents like the provision of first aid.",http://data.europa.eu/esco/skill/3d54fec5-d9cb-45a0-bf8d-ffaf3790a5bb,applying health-related skills and competences
KnowledgeSkillCompetence,http://data.europa.eu/esco/skill/5b0f2198-7246-4256-a902-4d9ce1260c80,skill/competence,transversal,ensure customer orientation,released,be friendly with customers | be customer oriented | enable customer focus | provide customer services | provide client support services | demonstrate service-oriented attitude | demonstrate customer orientation | ensure customer focus | enjoy dealing with customers,"Understand what customers want and adopt a positive attitude when interacting with them, providing advices, selling products or services or processing complaints. ",http://data.europa.eu/esco/skill/82463bb1-85d1-4e99-a4ce-08508fc3b2a3,supporting others
KnowledgeSkillCompetence,http://data.europa.eu/esco/skill/5b46f572-7ced-4efd-b270-a81a164d521c,skill/competence,transversal,moderate a discussion,released,"moderating discussions | carry out moderation | guide a discussion | apply moderation techniques | oversee a discussion | moderate workshops, conferences or events | lead discussions","Apply moderation techniques and methods to lead discussions between two or more people, including situations such as workshops, conferences or online events. Ensure the correctness and politeness of the debate.",http://data.europa.eu/esco/skill/6f142deb-03a9-4cd7-94ce-e0f023ae2169,communicating
KnowledgeSkillCompetence,http://data.europa.eu/esco/skill/5c3ab99d-a3f1-4620-9602-d12d2151a03d,skill/competence,transversal,"apply knowledge of science, technology and engineering",released,demonstrate scientific literacy | demonstrate technical abilities | take on new technology | carry out measurements,"Develop and apply an understanding of the physical world and its governing principles, for example by making reasonable predictions about causes and effects, conceiving tests of these predictions and carrying out measurements using suitable units, tools and equipment.",http://data.europa.eu/esco/skill/44ff6716-7d71-4a16-821b-61d10e9e290d,applying general knowledge
KnowledgeSkillCompetence,http://data.europa.eu/esco/skill/5c526c52-4f0a-4647-8c51-c91568acebb1,skill/competence,transversal,process spatial information,released,show three-dimensional imagination | demonstrate spatial intelligence | work with shapes and spaces | exhibit three-dimensional imagination | apply spatial reasoning | manage shape and space | utilise spatial orientation | display three-dimensional imagination | work with shape and space | work with form and space,"Be able to mentally imagine the position and relationship of bodies in three-dimensional spaces, developing a good sense of proportion. ",http://data.europa.eu/esco/skill/edc72cfe-78a8-4531-b00f-92992a0bb8cb,working with numbers and measures
KnowledgeSkillCompetence,http://data.europa.eu/esco/skill/5ca953f7-541d-4f67-bc55-7721348366cf,skill/competence,transversal,respect the diversity of cultural values and norms,released,show sensitivity towards different worldviews | support cultural diversity | take national cultural identity in consideration | take account of the diversity of cultural values and norms | demonstrate knowledge of the multi-cultural dimension of European societies,Demonstrate intercultural competence and respect for one's own cultural values and norms. Show tolerance of and appreciation for the different values and norms held by different people and cultures and developed under different circumstances or in different times and places.,http://data.europa.eu/esco/skill/d6e97b91-b75d-45f5-8566-667798957b0f,applying civic skills and competences
KnowledgeSkillCompetence,http://data.europa.eu/esco/skill/5cd1930c-278d-4929-b413-27352f5b3687,skill/competence,transversal,cope with uncertainty,released,handle ambiguity | dealing with uncertainty | deal with uncertainties | handle uncertainty | deal with uncertainty | manage uncertainty,Tolerate and work constructively within unexpected and unpredictable situations.,http://data.europa.eu/esco/skill/2b2c3254-7f6c-47e2-84f1-aece946fbfae,maintaining a positive attitude
KnowledgeSkillCompetence,http://data.europa.eu/esco/skill/609a8ac1-9d29-4237-9886-596dbbe7ca8a,skill/competence,transversal,address an audience,released,address audiences | present ideas | addressing an audience | speak to an audience | address an audience | give a talk to an audience | lecture | give a lecture to an audience | deliver a speech,"Speak in a structured, deliberate and face-to-face manner to a group of listeners to inform, influence, or entertain them.",http://data.europa.eu/esco/skill/6f142deb-03a9-4cd7-94ce-e0f023ae2169,communicating
KnowledgeSkillCompetence,http://data.europa.eu/esco/skill/60c78287-22eb-4103-9c8c-28deaa460da0,skill/competence,transversal,work in teams,released,work in teams | work in groups | working in teams | support colleagues | work in squads | handle team dynamics | foster social networks | cooperate with colleagues | team-working | cooperate | collaborate on tasks,Work confidently within a group with each doing their part in the service of the whole.,http://data.europa.eu/esco/skill/036afa6e-cdde-4b38-a53a-8e7910a840e1,collaborating in teams and networks
KnowledgeSkillCompetence,http://data.europa.eu/esco/skill/669b75d8-671c-4a1c-8e0b-6466c513c27d,skill/competence,transversal,show confidence,released,behave confidently | show of confidence | showing confidence | demonstrate confidence | display confidence | show confidence | exhibit confidence | reveal confidence | confidence showing,Demonstrate degrees of maturity by fully understanding one's own qualities and abilities which can serve as sources of confidence in different situations.,http://data.europa.eu/esco/skill/2b2c3254-7f6c-47e2-84f1-aece946fbfae,maintaining a positive attitude
KnowledgeSkillCompetence,http://data.europa.eu/esco/skill/699e7c26-6502-4e78-a823-3656ff5a5b8b,skill/competence,transversal,instruct others,released,train others | instruct others | instruct colleagues | tutoring | instructing others | educate others | teach others,Guide or teach others by providing relevant knowledge and support.,http://data.europa.eu/esco/skill/82463bb1-85d1-4e99-a4ce-08508fc3b2a3,supporting others
KnowledgeSkillCompetence,http://data.europa.eu/esco/skill/6b2f8802-0cbf-436e-a37f-ca55ede41bbc,skill/competence,transversal,operate digital hardware,released,use smart ICT devices | apply ICT peripherals | carry out practical tasks with smart devices | use digital devices | use mouse | use hardware | use keyboard | use hardware components | work with computer hardware and peripherals | use ICT hardware | use ICT peripherals,"Use equipment such as monitor, mouse, keyboard, storage devices, printers and scanners to perform operations such as plugging in, starting up, shutting down, rebooting, saving files and other operations.",http://data.europa.eu/esco/skill/3399045f-8078-4066-8b46-475b49b260ab,working with digital devices and applications
KnowledgeSkillCompetence,http://data.europa.eu/esco/skill/6b305973-8993-475f-bd8a-daf037c61401,skill/competence,transversal,"organise information, objects and resources",released,structure information | organise resources | have organisational skills | demonstrate organizational skills | record information | take in information,"Understand your tasks and the processes that go with them. Organize information, objects and resources using systematic methods and according to given standards and ensure that the task is mastered. ",http://data.europa.eu/esco/skill/66fdc34c-2326-4baa-b8ff-7a1d1015fe3a,planning and organising
KnowledgeSkillCompetence,http://data.europa.eu/esco/skill/6fc6f757-6baa-49fe-9a82-6ba6a52f2e13,skill/competence,transversal,interpret mathematical information,released,enjoy working with numbers | apply mathematical reasoning | apply numerical reasoning | apply numeracy skills | demonstrate an understanding of numbers,"Demonstrate an understanding of mathematical terms and concepts, and apply basic mathematical principles and processes to interpret data and facts.",http://data.europa.eu/esco/skill/edc72cfe-78a8-4531-b00f-92992a0bb8cb,working with numbers and measures
KnowledgeSkillCompetence,http://data.europa.eu/esco/skill/72d1fa5d-1b7f-48e7-84e3-6e779841ddf1,skill/competence,transversal,demonstrate loyalty,released,back company plan | champion company plan | support company mission | support plans of the company | follow organisation's vision | support company plan | show loyalty,"Demonstrate inner attachment to a group or organization, including by sharing and representing their values.",http://data.europa.eu/esco/skill/925af2b5-2f4d-4cce-92cc-79e1ff887c7d,following ethical code of conduct
KnowledgeSkillCompetence,http://data.europa.eu/esco/skill/75d8e5d9-bef3-418b-9011-01bff9f27207,skill/competence,transversal,lead others,released,guide others | take on a leadership role | leading others | lead others | direct others | supervise others | give direction | show leadership attitude | manage people | lead,"Guide and direct others towards a common goal, often in a group or team.",http://data.europa.eu/esco/skill/fe5eabaa-63f6-4c44-b405-fc3ded8d56cb,leading others
